name,description
Literature & Fiction,"Explore the wonderful world of children's literature and fiction books. From heartwarming tales to imaginative adventures, these books spark creativity and foster a love for reading."
Animals,"Learn about the fascinating world of animals through engaging stories and vibrant illustrations. Discover different species, habitats, and the importance of caring for our furry and feathered friends."
Growing Up & Facts of Life,"Navigate the journey of growing up with age-appropriate books that address physical and emotional changes, relationships, and important life lessons with sensitivity and wisdom."
Humor,"Unleash the power of laughter with hilarious books that tickle the funny bone. Filled with puns, jokes, and silly scenarios, these reads are sure to bring endless giggles."
Cars Trains & Things That Go,"Vroom! Choo-choo! Explore the exciting world of transportation with engaging books about cars, trains, planes, and more. Perfect for little ones fascinated by wheels and motion."
Fairy Tales Folk Tales & Myths,"Dive into the enchanting realm of fairy tales, folk tales, and myths from around the world. These timeless stories ignite imagination and teach valuable life lessons."
Activities Crafts & Games,"Unleash creativity and have fun with activity books, crafts projects, and games. From coloring to origami, these books provide endless entertainment and learning opportunities."
Science Fiction & Fantasy,"Embark on epic adventures and explore imaginative worlds in captivating science fiction and fantasy tales. These books inspire curiosity and transport readers to realms beyond our own."
Classics,"Discover beloved literary treasures that have stood the test of time. These classic children's books are cherished for their timeless themes, memorable characters, and enduring lessons."
Mysteries & Detectives,"Sharpen your problem-solving skills with thrilling mysteries and detective stories. Follow the clues, unravel the puzzles, and experience the excitement of solving cases."
Action & Adventure,"Get your adrenaline pumping with heart-pounding action and adventure tales. These page-turners take readers on daring quests, thrilling escapades, and courageous journeys."
Geography & Cultures,"Explore the rich tapestry of our world through fascinating books on geography and cultures. Discover new lands, traditions, and gain a deeper appreciation for diversity."
Education & Reference,"Enhance learning and knowledge with educational and reference books. From encyclopedias to study guides, these resources support academic growth and intellectual curiosity."
Arts Music & Photography,"Ignite creativity and appreciation for the arts with engaging books on music, visual arts, and photography. These books nurture artistic expression and cultural awareness."
Holidays & Celebrations,"Embrace the joy and traditions of holidays and celebrations from around the world. These festive books provide insights into customs, histories, and the spirit of special occasions."
Science Nature & How It Works,"Discover the wonders of science, nature, and how things work through captivating explanations and vibrant visuals. These books foster curiosity and a love for learning."
Early Learning,"Lay a strong foundation for learning with engaging books designed to support early childhood development. From ABCs to numbers, these resources promote essential skills."
Biographies,"Explore the remarkable lives of inspiring individuals through engaging biographies. These books celebrate achievements, perseverance, and the contributions of notable figures."
History,"Step back in time and learn about the events and people that shaped our world. These history books bring the past to life and nurture a deeper understanding of our heritage."
Children's Cookbooks,"Unleash your inner chef with fun and educational cookbooks designed specifically for young culinary enthusiasts. Learn cooking basics and create delicious dishes."
Religions,"Foster understanding and respect for diverse religious beliefs and traditions through insightful books on world religions, faiths, and spiritual practices."
Sports & Outdoors,"Celebrate the spirit of sportsmanship and adventure with exciting books on sports, outdoor activities, and athletic pursuits. These reads inspire an active and healthy lifestyle."
Comics & Graphic Novels,"Immerse yourself in the dynamic world of comics and graphic novels. These visually stunning books blend art and storytelling, captivating readers of all ages."
Computers & Technology,"Discover the fascinating world of computers and technology through engaging books that explain concepts, coding, and the role of technology in our lives."
